{
  "$schema": "https://json-schema.org/draft/2020-12/schema",
  "$id": "https://devshelf.ritualdev.in/schemas/perk.schema.json",
  "title": "DevShelf Developer Perk & Sponsorship",
  "description": "Schema for developer discounts, cloud credits, and maintainer sponsorships",
  "type": "array",
  "items": {
    "type": "object",
    "required": ["name", "url", "category", "perkValue", "eligibility"],
    "properties": {
      "name": {
        "type": "string",
        "minLength": 2,
        "description": "Name of the perk, discount, or sponsorship"
      },
      "url": {
        "type": "string",
        "format": "uri",
        "pattern": "^https?://",
        "description": "Official application or claim page URL"
      },
      "category": {
        "type": "string",
        "description": "Perk category (e.g. Cloud Credits & Infrastructure, Student & Education Packs)"
      },
      "description": {
        "type": "string",
        "maxLength": 300,
        "description": "Optional description of the benefit"
      },
      "perkValue": {
        "type": "string",
        "minLength": 3,
        "description": "Monetary or feature value of the perk (e.g. $1,000 Cloud Credits, Free Pro Plan)"
      },
      "eligibility": {
        "type": "string",
        "minLength": 5,
        "description": "Requirements to qualify for the perk"
      },
      "featured": {
        "type": "boolean",
        "description": "Whether this tool is highlighted in weekly spotlights"
      },
      "sponsorTier": {
        "type": "string",
        "description": "Optional verified sponsor tier metadata"
      },
      "statusTags": {
        "type": "array",
        "items": { "type": "string" },
        "description": "Optional telemetry status tags"
      },
      "lastCheckedAt": {
        "type": "string",
        "description": "ISO timestamp of most recent HTTP endpoint reachability check"
      },
      "lastVerifiedAt": {
        "type": "string",
        "description": "ISO timestamp when entry existence was verified by maintainer or automated pipeline"
      },
      "pricingVerifiedAt": {
        "type": "string",
        "description": "ISO timestamp when zero-paywall pricing terms and free tier were verified"
      },
      "healthStatus": {
        "type": "string",
        "enum": ["healthy", "degraded", "down", "redirected", "bot_challenge", "unknown"],
        "description": "Live endpoint operational status"
      },
      "authRequirements": {
        "type": "string",
        "description": "Detailed authentication requirement (e.g. none, free api key, oauth, registration)"
      },
      "freeTierLimits": {
        "type": "string",
        "description": "Specific free tier limits or perpetual zero-cost quotas"
      },
      "verifiedZeroPaywall": {
        "type": "boolean",
        "description": "Whether the resource is verified to have an authentic, permanent zero-paywall tier"
      },
      "redirectUrl": {
        "type": "string",
        "format": "uri",
        "pattern": "^https?://",
        "description": "Tracked redirect target URL if destination moved"
      }
    },
    "additionalProperties": false
  }
}
