[
  {
    "name": "JetBrains Free Open Source License",
    "url": "https://www.jetbrains.com/community/opensource",
    "category": "Developer Tools & IDEs",
    "description": "Free All Products Pack subscription (IntelliJ IDEA Ultimate, WebStorm, PyCharm, CLion, GoLand) for open-source maintainers.",
    "perkValue": "Free 1-Year All Products Pack ($779/yr value)",
    "eligibility": "Active open-source project (3+ months, non-commercial)"
  },
  {
    "name": "Sentry for Open Source",
    "url": "https://sentry.io/for/open-source",
    "category": "Error Tracking & Observability",
    "description": "Free Sentry Business plan for qualifying open-source maintainers to monitor application health, errors, and real-time performance.",
    "perkValue": "Free Sentry Business Plan ($312+/yr value)",
    "eligibility": "Public open-source repository with OSI-approved license"
  },
  {
    "name": "GitHub for Startups",
    "url": "https://github.com/enterprise/startups",
    "category": "Hosting & Dev Collaboration",
    "description": "Up to 20 seats of GitHub Enterprise free for 12 months, including GitHub Actions minutes, Advanced Security, and Copilot.",
    "perkValue": "Up to 20 Free Enterprise Seats ($5,000+ value)",
    "eligibility": "Series A or earlier startups"
  },
  {
    "name": "AWS Activate Founders",
    "url": "https://aws.amazon.com/activate",
    "category": "Cloud Infrastructure",
    "description": "Free AWS promotional cloud credits, technical support, and architectural guidance for early-stage builders and founders.",
    "perkValue": "$1,000 - $100,000 AWS Cloud Credits",
    "eligibility": "Self-funded or early-stage startups"
  },
  {
    "name": "Google Cloud for Startups",
    "url": "https://cloud.google.com/startup",
    "category": "Cloud Infrastructure & AI",
    "description": "Access up to $2,000 in GCP credits in year one, covering Compute Engine, Cloud Run, Vertex AI, and BigQuery.",
    "perkValue": "$2,000 in GCP Cloud Credits",
    "eligibility": "Early-stage bootstrap / funded startups"
  },
  {
    "name": "DigitalOcean Open Source Sponsorship",
    "url": "https://www.digitalocean.com/open-source",
    "category": "Cloud Hosting & Droplets",
    "description": "Monthly infrastructure credits to host open-source websites, build runners, test nodes, and documentation servers.",
    "perkValue": "Recurring Free Droplet / Bandwidth Credits",
    "eligibility": "Public open-source projects with active community"
  },
  {
    "name": "Postman Open Source Sponsorship",
    "url": "https://www.postman.com/open-source",
    "category": "API Development",
    "description": "Free Postman Team subscription for open-source teams maintaining public APIs and workspaces.",
    "perkValue": "Free Postman Team Plan",
    "eligibility": "Public API open-source projects"
  },
  {
    "name": "Datadog for Open Source",
    "url": "https://www.datadoghq.com/partner/open-source",
    "category": "Observability & APM",
    "description": "Free Datadog Pro infrastructure monitoring, log management, and APM for qualifying open-source projects.",
    "perkValue": "Free Datadog Pro Account ($180+/host/yr)",
    "eligibility": "Non-commercial OSI-approved open source projects"
  },
  {
    "name": "BrowserStack Open Source",
    "url": "https://www.browserstack.com/open-source",
    "category": "Cross-Browser & Device Testing",
    "description": "Free BrowserStack testing license for open-source maintainers across 3,000+ real desktop and mobile browsers.",
    "perkValue": "Free Unlimited Live & Automate Testing ($348+/yr)",
    "eligibility": "Public open-source repository with active development"
  },
  {
    "name": "Docker Open Source Community",
    "url": "https://www.docker.com/community/open-source/application",
    "category": "Container Registries & CI",
    "description": "Free Docker Hub Team account with unlimited image pulls, public repositories, and automated security vulnerability scans.",
    "perkValue": "Free Docker Hub Team Tier ($108+/yr value)",
    "eligibility": "Active OSI-compliant open-source projects"
  },
  {
    "name": "JetBrains Mono",
    "url": "https://github.com/JetBrains/JetBrainsMono",
    "category": "Developer Fonts & Aesthetics",
    "description": "Free monospaced coding font with toggleable OpenType ligatures; a no-ligature variant is also available.",
    "perkValue": "Free download (SIL Open Font License 1.1)",
    "eligibility": "Free for personal and commercial use under OFL 1.1"
  },
  {
    "name": "Fira Code",
    "url": "https://github.com/tonsky/FiraCode",
    "category": "Developer Fonts & Aesthetics",
    "description": "Free monospaced font with programming ligatures; the ligatures change how code is rendered, not its underlying characters.",
    "perkValue": "Free download (SIL Open Font License 1.1)",
    "eligibility": "Free to use under OFL 1.1"
  },
  {
    "name": "Cascadia Code",
    "url": "https://github.com/microsoft/cascadia-code",
    "category": "Developer Fonts & Aesthetics",
    "description": "Free monospaced coding font with programming ligatures; Cascadia Mono is the variant without ligatures.",
    "perkValue": "Free download (SIL Open Font License 1.1)",
    "eligibility": "Free to use under OFL 1.1"
  },
  {
    "name": "GitHub Student Developer Pack",
    "url": "https://education.github.com/pack",
    "category": "Cloud Credits & Developer Packs",
    "description": "Free developer tools, cloud hosting credits (DigitalOcean, Azure), domain names, and GitHub Pro for verified students.",
    "perkValue": "$200,000+ in free developer tooling and courses",
    "eligibility": "Verified students aged 13+ with school-issued email or proof of enrollment"
  },
  {
    "name": "Microsoft for Startups Founders Hub",
    "url": "https://www.microsoft.com/startups",
    "category": "Cloud Credits & Developer Packs",
    "description": "Up to $150,000 in Azure cloud credits, free access to OpenAI models, GitHub Enterprise, and LinkedIn tools for tech startups.",
    "perkValue": "Up to $150,000 in Azure credits + OpenAI access",
    "eligibility": "Software or AI startups building a product (no funding required)"
  },
  {
    "name": "Cloudflare for Open Source",
    "url": "https://www.cloudflare.com/open-source-sponsorship",
    "category": "Open Source Sponsorship",
    "description": "Free enterprise-grade CDN, DDoS protection, edge workers, and SSL certificate management for open-source initiatives.",
    "perkValue": "Free Enterprise Plan features & Edge bandwidth",
    "eligibility": "Non-profit or community-driven open-source projects with OSI-approved licenses"
  },
  {
    "name": "1Password for Open Source",
    "url": "https://github.com/1Password/op-connect-playbook",
    "category": "Open Source Sponsorship",
    "description": "Free 1Password Teams accounts for open-source project maintainers to securely share secrets and API tokens.",
    "perkValue": "Free 1Password Teams subscription",
    "eligibility": "Active open-source project maintainers with public GitHub repositories"
  },
  {
    "name": "Netlify for Open Source",
    "url": "https://www.netlify.com/open-source",
    "category": "Open Source Sponsorship",
    "description": "Free team plan with increased build minutes, bandwidth, and preview deployments for eligible open-source projects.",
    "perkValue": "Free Netlify Pro Team tier",
    "eligibility": "Non-commercial open source projects displaying a Netlify badge"
  },
  {
    "name": "Vercel for Open Source",
    "url": "https://vercel.com/docs/accounts/plans/pro#open-source",
    "category": "Open Source Sponsorship",
    "description": "Free Pro sponsorship with elevated edge compute limits and team features for popular open-source projects.",
    "perkValue": "Free Vercel Pro Plan sponsorship",
    "eligibility": "Public open source projects with active community adoption and OSI license"
  },
  {
    "name": "GitLab for Open Source",
    "url": "https://about.gitlab.com/solutions/open-source/program",
    "category": "Open Source Sponsorship",
    "description": "Free top-tier GitLab Ultimate with 50,000 CI build minutes per month and security scanning for public open-source projects.",
    "perkValue": "GitLab Ultimate subscription ($1,188/user/year value) + 50k CI mins",
    "eligibility": "Public open-source projects with OSI-approved licenses"
  },
  {
    "name": "Atlassian Open Source Project Licensing",
    "url": "https://www.atlassian.com/software/views/open-source-license-request",
    "category": "Open Source Sponsorship",
    "description": "Free cloud subscriptions for Jira Software, Confluence, and Jira Service Management for qualifying open source initiatives.",
    "perkValue": "Free Jira & Confluence Cloud licenses",
    "eligibility": "Active open-source projects with public repositories and standard licenses"
  },
  {
    "name": "JetBrains Student Pack",
    "url": "https://www.jetbrains.com/community/education#students",
    "category": "Student & Education",
    "description": "Free individual annual subscription to all JetBrains IDEs (IntelliJ IDEA, WebStorm, PyCharm, CLion, Rider) for students.",
    "perkValue": "$289/year in professional IDE licenses",
    "eligibility": "Students and teachers with valid educational email address"
  },
  {
    "name": "Notion for Education",
    "url": "https://www.notion.so/product/notion-for-education",
    "category": "Student & Education",
    "description": "Free Personal Pro plan for students and educators with unlimited file uploads, 30-day page history, and collaborative workspaces.",
    "perkValue": "$96/year Personal Pro subscription",
    "eligibility": "Students and teachers with school email address"
  },
  {
    "name": "Twilio Startups Program",
    "url": "https://www.twilio.com/en-us/startups",
    "category": "Cloud Credits & Developer Packs",